statement,alternative_a,alternative_b,alternative_c,alternative_d,alternative_e,correct_answer,position,board,contest,subject,topic,year,explanation,organization,exam,page,question,references,keywords,status,package,package_version
"Algumas medidas podem ser úteis para aumentar a produção do leite materno. Sobre esse assunto, assinale a alternativa correta.",Diminuir a frequência das mamadas,Dar tempo para o bebê esvaziar bem as mamas,Oferecer apenas uma das mamas em cada mamada,"Após a mamada, não ordenhar o leite residual",,B,enfermeiro,ibfc,concurso-publico-sesacre-edital-01-2022,saude-da-crianca-e-do-adolescente,aleitamento-materno,2022,Medidas para aumentar produção láctea incluem esvaziamento frequente e apoio; alternativa B.,,,11,55,,producao leite; amamentacao; lactacao; manejo; difficulty:Fácil,ACTIVE,,
"Sobre as condutas que o enfermeiro deve ter perante as queixas mais comuns na gestação, analise as afirmativas abaixo e dê valores Verdadeiro (V) ou Falso (F). ( ) Na queixa de corrimento vaginal, deve-se prescrever cremes vaginais, mesmo que não haja diagnóstico de infecção vaginal. ( ) Na queixa de pirose, deve-se orientar a gestante a consumir dieta fracionada, evitando frituras, café, chá preto, mates, doces, álcool e fumo. ( ) Na queixa de sialorreia, deve-se orientar que é um sintoma comum no início da gestação e orientar a gestante a deglutir a saliva e tomar líquidos em abundância (especialmente em épocas de calor). ( ) Na queixa de fraquezas e desmaios, deve-se orientar a gestante para que não faça mudanças bruscas de posição e evite a inatividade. Assinale a alternativa que apresenta a sequência correta de cima para baixo.",V - F - V - F,V - V - V - V,F - V - F - V,F - V - V - V,,D,enfermeiro,ibfc,concurso-publico-sesacre-edital-01-2022,saude-da-mulher,assistencia-de-enfermagem-ao-pre-natal-parto-e-puerperio,2022,Condutas de enfermagem perante queixas na gestação conforme alternativa D.,,,11,56,,gestacao; queixas comuns; enfermagem; pre-natal; difficulty:Média,ACTIVE,,
"A sífilis é uma infecção bacteriana sistêmica, de evolução crônica, causada pelo Treponema pallidum. Sobre essa doença, analise as afirmativas abaixo. I. A transmissão por transfusão de sangue ou derivados pode ocorrer, mas se tornou muito rara, devido ao controle e à testagem do sangue doado pelos hemocentros. II. A transmissão sexual é a predominante. Os sítios de inoculação do T. pallidum são, em geral, os órgãos genitais, podendo ocorrer também manifestações extragenitais (lábios, língua e áreas da pele com solução de continuidade). III. A transmissibilidade da sífilis adquirida requer a presença de lesões (cancro duro, condiloma plano, placas mucosas, lesões úmidas). Estão corretas as afirmativas:",III apenas,II e III apenas,II apenas,"I, II e III 10 IBFC_11",,D,enfermeiro,ibfc,concurso-publico-sesacre-edital-01-2022,enfermagem-em-doencas-transmissiveis,prevencao-e-controle-de-doencas-transmissiveis,2022,Sífilis é IST bacteriana sistêmica; condutas conforme alternativa D.,,,11,57,,sifilis; treponema pallidum; ist; tratamento; difficulty:Média,ACTIVE,,
"Sobre o uso de método anticoncepcional durante o aleitamento materno, analise as afirmativas abaixo e dê valores Verdadeiro (V) ou Falso (F). ( ) Durante os primeiros seis meses pós-parto, a amamentação exclusiva, à livre demanda, com amenorreia, está associada à diminuição da fertilidade. ( ) O efeito inibidor da fertilidade (que o aleitamento exclusivo com amenorreia tem) pode ser utilizado como método comportamental de anticoncepção, chamado de LAM (método da amenorreia da lactação). ( ) O anticoncepcional hormonal oral combinado e o injetável mensal devem ser utilizados em lactantes, pois não interferem na qualidade e na quantidade do leite materno e não afetam adversamente a saúde do bebê. ( ) O dispositivo intrauterino (DIU) pode ser inserido imediatamente após o parto ou a partir de quatro semanas pós-parto. O DIU está contraindicado para os casos que cursaram com infecção puerperal até três meses após a cura. Assinale a alternativa que apresenta a sequência correta de cima para baixo.",V - V - F - V,V - V - V - V,V - F - V - F,F - V - F - V,,A,enfermeiro,ibfc,concurso-publico-sesacre-edital-01-2022,saude-da-mulher,planejamento-reprodutivo,2022,Métodos contraceptivos durante aleitamento: afirmativas V/F conforme alternativa A.,,,12,58,,anticoncepcional; aleitamento; lactacao; metodo; difficulty:Média,ACTIVE,,
"No que se refere ao conteúdo microbiano de uma ferida, esta é considerada ______, quando o local apresenta intensa reação inflamatória e microrganismos que podem produzir exsudato purulento com odor fétido. Assinale a alternativa que preencha corretamente a lacuna.",contaminada,infectada,potencialmente contaminada,limpa,,B,enfermeiro,ibfc,concurso-publico-sesacre-edital-01-2022,fundamentos-de-enfermagem,feridas-e-cicatrizacao,2022,Ferida infectada apresenta reação tissular intensa e carga microbiana significativa; alternativa B.,,,12,59,,ferida; carga microbiana; infeccao; colonizacao; difficulty:Média,ACTIVE,,
"A dermatite de contato é uma reação inflamatória na pele decorrente da exposição a um agente capaz de causar irritação ou alergia. Sobre a dermatite de contato, assinale a alternativa correta.","O irritante agressor deve ser identificado mas não removido; em geral, se utiliza sabão até que ocorra cicatrização das lesões",Os homens tendem a ser afetados mais comumente que as mulheres,É uma reação inflamatória da pele causada apenas por agentes químicos,"Os fatores predisponentes consistem em extremos de calor e de frio, uso frequente de sabão e água e doença cutânea preexistente",,D,enfermeiro,ibfc,concurso-publico-sesacre-edital-01-2022,fundamentos-de-enfermagem,curativos,2022,Dermatite de contato é reação inflamatória por exposição a agente irritante/alérgeno; alternativa D.,,,12,60,,dermatite de contato; pele; irritacao; alergia; difficulty:Média,ACTIVE,,
"A catarata é a maior causa de cegueira tratável nos países em desenvolvimento. Sobre Catarata, analise as afirmativas abaixo. I. A catarata pode desenvolver-se em um ou em ambos os olhos e em qualquer idade. II. Tabagismo, uso de corticosteroides a longo prazo (particularmente em altas doses), luz solar e radiação ionizante, diabetes melito, obesidade e lesões oculares podem aumentar o risco de catarata. III. As manifestações clínicas da catarata são visão clara e dor ocular. IV. Tratamentos não cirúrgicos eficazes como medicamentos, colírios e óculos, podem curar a catarata ou impedir o surgimento dessas relacionadas com a idade. V. O tratamento clínico ótimo consiste em prevenção, incluindo instrução do cliente sobre as estratégias de redução de risco, como abandono do tabagismo e uso de óculos de sol em ambientes externos. Estão corretas as afirmativas:","II, III e IV apenas","II, III e V apenas","I, II e V apenas","I, II, III, IV e V",,C,enfermeiro,ibfc,concurso-publico-sesacre-edital-01-2022,fundamentos-de-enfermagem,semiologia-de-enfermagem,2022,Catarata é principal causa tratável de cegueira em países em desenvolvimento; alternativa C.,,,12,61,,catarata; cegueira; olho; visao; difficulty:Média,ACTIVE,,
"______ é uma lesão dos tecidos moles produzida por uma força não penetrante (como por exemplo pancada, chute ou queda), causando ruptura dos vasos sanguíneos de pequeno calibre, com sangramento nos tecidos moles (equimoses). Observa-se o desenvolvimento de hematoma quando o sangramento é suficiente para causar acúmulo apreciável de sangue, produzindo aspecto característico de “lesão arroxeada”. Sua resolução ocorre em 1 a 2 semanas. Assinale a alternativa que preencha corretamente a lacuna.",Estiramento,Entorse,Contusão,Luxação articular,,C,enfermeiro,ibfc,concurso-publico-sesacre-edital-01-2022,urgencia-e-emergencia,atendimento-ao-politraumatizado,2022,Contusão é lesão de tecidos moles por força não penetrante; alternativa C.,,,12,62,,contusao; tecido mole; trauma; forca nao penetrante; difficulty:Média,ACTIVE,,
"O diabetes mellitus, comumente designado como diabetes, abrange um grupo de doenças metabólicas, caracterizadas por níveis elevados de glicose no sangue (hiperglicemia), devido a defeitos na secreção ou na ação da insulina ou em ambas. Sobre o diabetes mellitus tipo 2, assinale a alternativa correta.","Caracteriza-se pela destruição das células beta do pâncreas, devido a fatores genéticos, imunológicos e, possivelmente ambientais. São necessárias injeções de insulina para controlar os níveis de glicemia","O tratamento consiste na adoção de hábitos de vida saudáveis, como uma alimentação equilibrada, prática regular de atividade física, moderação no uso de álcool e abandono do tabagismo, acrescido ou não do tratamento farmacológico",A cetoacidose diabética (CAD) é mais comum em indivíduos com diabetes tipo 2,"O diabetes tipo 2 tem início súbito, geralmente antes dos 30 anos de idade IBFC_11 11",,B,enfermeiro,ibfc,concurso-publico-sesacre-edital-01-2022,fundamentos-de-enfermagem,sinais-vitais,2022,Diabetes mellitus caracteriza-se por hiperglicemia crônica por defeito na secreção/ação da insulina; alternativa B.,,,12,63,,diabetes mellitus; glicemia; metabolismo; doenca cronica; difficulty:Média,ACTIVE,,
"O Transtorno da Compulsão Alimentar Periódica caracteriza-se pela ingestão descontrolada de grande quantidade de alimentos, sem apetite e quase sem mastigar, até que seja alcançada a plenitude. Sobre o Transtorno da Compulsão Alimentar Periódica, analise as afirmativas abaixo e dê valores Verdadeiro (V) ou Falso (F). ( ) Este transtorno é caracterizado por compulsão alimentar em um curto espaço de tempo, seguida de angústia por essa atitude e ausência de comportamentos regulares voltados para a eliminação do excesso alimentar. ( ) Para a caracterização do diagnóstico, esses episódios devem ocorrer pelo menos quatro dias por semana no período de doze meses. ( ) Apesar de mais frequente em indivíduos obesos, ocorre também em pessoas com peso normal. ( ) Acomete indivíduos de todas as raças, com distribuição aproximada entre os sexos e início habitual na adolescência. Assinale a alternativa que apresenta a sequência correta de cima para baixo.",V - F - F - F,V - V - V - V,F - V - F - V,V - F - V - V,,D,enfermeiro,ibfc,concurso-publico-sesacre-edital-01-2022,saude-mental,transtornos-mentais-e-comportamentais,2022,Transtorno da Compulsão Alimentar Periódica envolve ingestão descontrolada; alternativa D.,,,13,64,,compulsao alimentar; transtorno alimentar; ingestao descontrolada; tca; difficulty:Média,ACTIVE,,
"Sobre o Transtorno do Espectro Autista (TEA), analise as afirmativas abaixo. I. Sobre a etiologia do autismo, diversos estudos apontam múltiplos fatores envolvidos, como lesões neurológicas perinatais, rubéola congênita, fenilcetonúria, esclerose tuberosa, alterações genéticas, incompatibilidade imunológica entre mãe e feto, sofrimento fetal e uso de medicamentos no período gestacional. II. A vacina tríplice viral (sarampo, caxumba e rubéola) ou os conservantes utilizados em programas de imunização (timerosol) são grandes causadores de autismo em crianças. III. A avaliação das características autísticas em uma criança não é clínica, mas sim realizada por exames específicos comprobatórios que orientam o diagnóstico. IV. Os sintomas são contato visual anormal, atraso na linguagem, sendo os mais comuns e ecolalia (imediata ou posterior) e a inversão pronominal, a presença de estereotipias e o maneirismo, como a resistência às mudanças. Estão corretas as afirmativas:",I e IV apenas,"I, II e III apenas","I, III e IV apenas","I, II, III e IV",,A,enfermeiro,ibfc,concurso-publico-sesacre-edital-01-2022,saude-mental,transtornos-mentais-e-comportamentais,2022,TEA: afirmativas sobre etiologia e diagnóstico conforme alternativa A.,,,13,65,,tea; autismo; espectro autista; desenvolvimento; difficulty:Média,ACTIVE,,
"_______ representa uma síndrome reversível específica à ingestão recente de determinada droga. Os critérios que a definem baseiam-se nas evidências recentes do uso e incluem comportamento inadequado, agressividade, labilidade de humor, prejuízo na coordenação psicomotora e julgamento de realidade, lentificação psicomotora e déficit cognitivo. Assinale a alternativa que preencha corretamente a lacuna.",intoxicação por substâncias,abstinência de substâncias,abuso de substância,síndrome de dependência,,A,enfermeiro,ibfc,concurso-publico-sesacre-edital-01-2022,urgencia-e-emergencia,intoxicacoes-exogenas,2022,Síndrome serotoninérgica é reversível por ingestão recente de drogas serotonérgicas; alternativa A.,,,13,66,,sindrome serotoninergica; droga; intoxicacao; serotonina; difficulty:Difícil,ACTIVE,,
"Sobre Educação em Saúde, analise as afirmativas abaixo e dê valores Verdadeiro (V) ou Falso (F). ( ) A educação na saúde consiste na produção e sistematização de conhecimentos relativos à formação e ao desenvolvimento para a atuação em saúde, envolvendo práticas de ensino, diretrizes didáticas e orientação curricular. ( ) Também conhecida como educação no trabalho em saúde, a educação na saúde apresenta apenas a modalidade de educação continuada. ( ) A educação continuada contempla as atividades que possui período definido para execução e utiliza, em sua maior parte, os pressupostos da metodologia de ensino tradicional, como exemplo as ofertas formais nos níveis de pós- graduação. Assinale a alternativa que apresenta a sequência correta de cima para baixo.",F - V - V,V - V - F,V - F - V,F - F - V,,C,enfermeiro,ibfc,concurso-publico-sesacre-edital-01-2022,fundamentos-de-enfermagem,comunicacao-terapeutica,2022,Educação em saúde integra promoção e participação; afirmativas V/F conforme alternativa C.,,,13,67,,educacao em saude; promocao saude; comunicacao; sus; difficulty:Média,ACTIVE,,
"Foi prescrita a posição ______, na qual o paciente deverá ser colocado em decúbito dorsal horizontal, com o corpo inclinado, de forma que a cabeça fique em nível mais baixo em relação ao corpo. Assinale a alternativa que preencha corretamente a lacuna.",Fowler,Trendelenburg,Genupeitoral,Litotomia,,B,enfermeiro,ibfc,concurso-publico-sesacre-edital-01-2022,fundamentos-de-enfermagem,mobilizacao-e-transporte-do-paciente,2022,Posição de Fowler: decúbito dorsal com elevação do tronco; alternativa B.,,,13,68,,posicao fowler; decubito; posicionamento; paciente; difficulty:Média,ACTIVE,,
Assinale a alternativa que contemple uma assistência de enfermagem correta para um paciente que apresenta hipertermia.,Aquecer o paciente com agasalhos e cobertores,Aumentar a ingesta líquida e repouso,Manter o ambiente aquecido,Ingestão de alimentos quentes 12 IBFC_11,,B,enfermeiro,ibfc,concurso-publico-sesacre-edital-01-2022,fundamentos-de-enfermagem,sinais-vitais,2022,Assistência ao paciente com hipertermia inclui medidas da alternativa B.,,,13,69,,hipertermia; febre; cuidados enfermagem; termorregulacao; difficulty:Média,ACTIVE,,
"O processamento de produtos constitui a prática de descontaminar e preparar produtos utilizados no apoio ao diagnóstico e terapia e na assistência aos pacientes, como cirurgias, procedimentos e alguns tipos de exames, de forma a garantir a reutilização ou descarte seguro destes produtos em serviços prestados por profissionais de saúde em hospitais, clínicas, consultórios médicos, odontológicos, entre outros. Sobre o processamento dos produtos para saúde, assinale a alternativa correta.","O Serviço de Saúde não será co-responsável pela segurança do processamento dos produtos para saúde, realizado por empresa processadora por ele contratada","Produtos para saúde utilizados na assistência ventilatória e inaloterapia, deverão ser submetidos à desinfecção por métodos de imersão química líquida com a utilização de saneantes a base de aldeídos",O processamento de produtos deve seguir um fluxo direcionado sempre da área limpa para a área suja,"Produtos para saúde classificados como não- críticos devem ser submetidos, no mínimo, ao processo de limpeza",,D,enfermeiro,ibfc,concurso-publico-sesacre-edital-01-2022,centro-cirurgico-e-cme,central-de-material-esterilizado,2022,Processamento envolve descontaminação e preparo de produtos para saúde; alternativa D.,,,14,70,,processamento produtos; descontaminacao; cme; esterilizacao; difficulty:Média,ACTIVE,,
"Sobre a esterilização dos produtos para saúde realizada em Centro de Material e Esterilização (CME), assinale a alternativa correta.","É obrigatório realizar o ciclo de esterilização a vapor para uso imediato, no primeiro ciclo do dia",É permitido o uso de autoclave gravitacional de capacidade superior a 100 litros,É permitido o uso de estufas para a esterilização de produtos para saúde,"É obrigatório a realização de teste para avaliar o desempenho do sistema de remoção de ar (Bowie & Dick) da autoclave assistida por bomba de vácuo, no primeiro ciclo do dia",,D,enfermeiro,ibfc,concurso-publico-sesacre-edital-01-2022,centro-cirurgico-e-cme,central-de-material-esterilizado,2022,Esterilização em CME segue normas técnicas; alternativa D correta.,,,14,71,,esterilizacao; cme; produtos saude; controle; difficulty:Média,ACTIVE,,
Assinale a alternativa que contemple um material de saúde do tipo crítico.,Cânula de Guedel,Comadres,Vidraria para aspiração,Copos e talheres,,C,enfermeiro,ibfc,concurso-publico-sesacre-edital-01-2022,centro-cirurgico-e-cme,central-de-material-esterilizado,2022,Material crítico entra em contato com tecido estéril; alternativa C.,,,14,72,,material critico; esterilizacao; classificacao spaulding; produtos saude; difficulty:Média,ACTIVE,,
"Considerando a Resolução nº 0509/2016, que trata da Anotação de Responsabilidade Técnica, pelo Serviço de Enfermagem, bem como, as atribuições do Responsável Técnico, assinale a alternativa correta.","A Certidão de Responsabilidade Técnica (CRT) é um documento emitido pelo Conselho Federal de Enfermagem, pelo qual se materializa o ato administrativo de concessão de Anotação de Responsabilidade Técnica pelo Serviço de Enfermagem","O Responsável Técnico deve ser profissional de nível superior da área da Saúde, preferencialmente da Enfermagem","O Responsável Técnico tem sob sua responsabilidade o planejamento, organização, direção, coordenação, execução e avaliação dos serviços de Enfermagem, a quem é concedida, pelo Conselho Regional de Enfermagem",A Anotação de Responsabilidade Técnica (ART) terá validade de 24 meses; e a Certidão de Responsabilidade Técnica (CRT) terá validade de 5 (cinco) anos,,C,enfermeiro,ibfc,concurso-publico-sesacre-edital-01-2022,etica-e-legislacao-em-enfermagem,enfermagem-em-auditoria-resolucao-cofen,2022,Resolução COFEN 509/2016 trata de ART do serviço de enfermagem; alternativa C.,,,14,73,,art; responsabilidade tecnica; cofen; norma:res-cofen-509-2016; difficulty:Média,ACTIVE,,
"O técnico de Enfermagem assumiu plantão às 19 horas para cumprir a jornada noturna de 12 horas. Após o recebimento do plantão, já havia passado por outra jornada diurna de trabalho e se encontrava exausto, desta forma foi descansar na sala de TV e acabou cochilando e deixando de fazer as medicações e realizar o controle dos sinais vitais das 20 horas dos pacientes da unidade. Por volta das 23 horas o paciente RTF, 59 anos, apresentou parada cardiorrespiratória sendo atendido pelo médico, porem acabou indo à óbito. Foi constatado pelo médico que o paciente apresentou PCR por não ter recebido o medicamento prescrito e não ter realizado o controle dos sinais vitais do paciente pelo técnico de enfermagem. Considerando a falha do profissional no aspecto ético, é correto afirmar que trata-se de:",negligência,imprudência,imperícia,homicídio culposo,,A,enfermeiro,ibfc,concurso-publico-sesacre-edital-01-2022,etica-e-legislacao-em-enfermagem,lei-7498-1986-exercicio-profissional-de-enfermagem,2022,Atribuições do técnico em plantão noturno conforme Lei 7.498/86; alternativa A.,,,14,74,,tecnico enfermagem; plantao; jornada; atribuicoes; difficulty:Média,ACTIVE,,
"A prática do trabalho em equipe de saúde e de Enfermagem teve seu início em 1950, em um cenário de mudanças das concepções de saúde e doença e, do modo de organização dos serviços de saúde. Considerando a organização de trabalho por equipe denominada integração, assinale a alternativa correta.",Almeja a articulação das ações e de interação dos profissionais,"Ocorre justaposição das ações, permitindo exclusivamente o agrupamento de agentes envolvidos","Ocorre polarização de uma parte do grupo, com tendência a especialização das ações","Ocorre a desfragmentação das ações, por formação de pequenos grupos especializados",,A,enfermeiro,ibfc,concurso-publico-sesacre-edital-01-2022,fundamentos-de-enfermagem,historia-da-enfermagem,2022,Prática de trabalho em equipe de saúde teve marco na década de 1950; alternativa A.,,,14,75,,trabalho em equipe; enfermagem; historia; equipe de saude; difficulty:Média,ACTIVE,,
"Hospitais magnéticos caracterizam-se pela plena estrutura organizacional, que fornece subsídios ao desenvolvimento do profissional, a partir do investimento em formação e em educação permanente. Dessa forma, possibilita tomada de decisão baseada em evidências. Considerando características-chave de um hospital magnético, assinale a alternativa correta.","O médico é responsável pelas atividades relacionadas ao cuidado do paciente, sendo que o Enfermeiro não possui autonomia por sua prática","Estrutura organizacional centralizada, permitindo maior controle sobre o ambiente de trabalho imediato e forte envolvimento da enfermagem na estrutura central da instituição","Estilo de administração participativo, caracterizado pelo envolvimento da equipe em todos os níveis",Os Enfermeiros não possuem permissão para desenvolver o julgamento independente IBFC_11 13,,C,enfermeiro,ibfc,concurso-publico-sesacre-edital-01-2022,administracao-em-enfermagem,enfermeiro-gestor,2022,Hospitais magnéticos possuem estrutura organizacional que subsidia prática de enfermagem; alternativa C.,,,14,76,,hospital magnetico; gestao; qualidade; enfermagem; difficulty:Média,ACTIVE,,
"O conhecimento do desenvolvimento normal da criança possibilita a identificação de atrasos, desvios e transtornos que permeiam o processo biopsicossocial. O ______ é desencadeado por algum estímulo brusco como bater palmas, estirar bruscamente o lençol onde a criança está deitada ou soltar os braços semiesticados quando se faz a avaliação da preensão palmar. O reflexo consiste em uma resposta de extensão-abdução dos membros superiores (eventualmente dos inferiores), ou seja, na primeira fase os braços ficam estendidos e abertos, com abertura dos dedos da mão, e em seguida de flexão-adução dos braços, com retorno à posição original. Assinale a alternativa que preencha corretamente a lacuna.",reflexo abstrato,reflexo de Moro,reflexo da comunicação visual,reflexo de Bournout,,B,enfermeiro,ibfc,concurso-publico-sesacre-edital-01-2022,saude-da-crianca-e-do-adolescente,crescimento-e-desenvolvimento-infantil,2022,Conhecimento do desenvolvimento normal permite identificar atrasos e desvios; alternativa B.,,,15,77,,desenvolvimento infantil; marcos; atrasos; crianca; difficulty:Média,ACTIVE,,
"A Política Nacional de Práticas Integrativas e Complementares (PNPIC) define responsabilidades institucionais para a implantação e implementação das Práticas Integrativas e Complementares (PICS) e orienta que estados, distrito federal e municípios instituam suas próprias normativas trazendo para o Sistema Único de Saúde (SUS) práticas que atendam às necessidades regionais. Uma das PICS é ______, que é uma prática de imposição de mãos que usa a aproximação ou o toque sobre o corpo da pessoa com a finalidade de estimular os mecanismos naturais de recuperação da saúde. Baseado na concepção vitalista de saúde e doença também presente em outros sistemas terapêuticos, considera a existência de uma energia universal canalizada que atua sobre o equilíbrio da energia vital com o propósito de harmonizar as condições gerais do corpo e da mente de forma integral. Assinale a alternativa que preencha corretamente a lacuna.",Yoga,Shantala,Quiropraxia,Reiki,,D,enfermeiro,ibfc,concurso-publico-sesacre-edital-01-2022,legislacao-do-sus,politica-nacional-de-praticas-integrativas-e-complementares-pnpic,2022,PNPIC define responsabilidades institucionais para PICS no SUS; alternativa D.,,,15,78,,pnpic; praticas integrativas; sus; responsabilidades; difficulty:Média,ACTIVE,,
